{
  "schemaVersion": "1.0.0",
  "removalId": "aaaaaaaa-aaaa-4aaa-8aaa-aaaaaaaaaaaa",
  "transitionId": "a1111111-1111-4111-8111-111111111111",
  "lifecycleRevision": 1,
  "previousState": null,
  "publicationId": "33333333-3333-4333-8333-333333333333",
  "assessmentId": "11111111-1111-4111-8111-111111111111",
  "installationId": 9001,
  "repositoryNodeId": "R_fixture_target",
  "pullRequestNodeId": "PR_target_42",
  "pullRequestNumber": 42,
  "retentionTransitionId": "bbbbbbbb-bbbb-4bbb-8bbb-bbbbbbbbbbbb",
  "retentionRevision": 2,
  "retentionState": "subject_deleted",
  "deletionRequestId": "d1111111-1111-4111-8111-111111111111",
  "expiryPolicyVersion": null,
  "commentId": 123456,
  "state": "queued",
  "attemptCount": 0,
  "lastAttemptAt": null,
  "providerDeletionCompletedAt": null,
  "providerReceiptDigest": null,
  "createdAt": "2026-07-21T00:10:01Z",
  "updatedAt": "2026-07-21T00:10:01Z",
  "auditExpiresAt": "2026-08-20T00:10:01Z",
  "commentOwnershipObservationId": "69696969-6969-4969-8969-696969696969",
  "transactionId": "87878787-1111-4111-8111-111111111111",
  "databaseCommitToken": "50a8570a9c6fe9cdaeb5da6bb2c7c0845995b77044b528116e46bc9ecb99c9e3",
  "outboxBatchId": "87878787-2222-4222-8222-222222222222",
  "originTransactionId": "81818181-8181-4181-8181-818181818181",
  "originDatabaseCommitToken": "02ef07dac371db4fea6d3ac6eb6aef3b85739ea31045640b6d6a8675fd9a4fbc",
  "originOutboxBatchId": "82828282-8282-4282-8282-828282828282",
  "deletionAuthorityId": "7a7a7a7a-7a7a-4a7a-8a7a-7a7a7a7a7a7a",
  "deletionAuthorityDigest": "160619c4181c7038f942229d29ccae3e5442d691eafcdee60be085fb5532e6bb",
  "outputCursorRevision": 4,
  "outputCursorDigest": "7f1e7af6e2d2046ed9a42af81895aa316666cb362a1599d1b2ba47dd496b9bd5",
  "commentInventoryObservationId": "79797979-7979-4979-8979-797979797979",
  "commentInventoryDigest": "b80a4d76019288a77527be048269d04e0e6cd8da249833372d9f89e15479cfab"
}
