{
  "schemaVersion": "1.0.0",
  "removalId": "aaaaaaaa-aaaa-4aaa-8aaa-aaaaaaaaaaaa",
  "transitionId": "a3333333-3333-4333-8333-333333333333",
  "lifecycleRevision": 3,
  "previousState": "removing",
  "publicationId": "33333333-3333-4333-8333-333333333333",
  "assessmentId": "11111111-1111-4111-8111-111111111111",
  "installationId": 9001,
  "repositoryNodeId": "R_fixture_target",
  "pullRequestNodeId": "PR_target_42",
  "pullRequestNumber": 42,
  "retentionTransitionId": "bbbbbbbb-bbbb-4bbb-8bbb-bbbbbbbbbbbb",
  "retentionRevision": 2,
  "retentionState": "subject_deleted",
  "deletionRequestId": "d1111111-1111-4111-8111-111111111111",
  "expiryPolicyVersion": null,
  "commentId": 123456,
  "state": "removed",
  "attemptCount": 1,
  "lastAttemptAt": "2026-07-21T00:10:02Z",
  "providerDeletionCompletedAt": "2026-07-21T00:10:03Z",
  "providerReceiptDigest": "451884ae33317d467c3a15f358f5a7b447150e96048882b805a9d736fe33f21e",
  "createdAt": "2026-07-21T00:10:01Z",
  "updatedAt": "2026-07-21T00:10:03Z",
  "auditExpiresAt": "2026-08-20T00:10:01Z",
  "commentOwnershipObservationId": "69696969-6969-4969-8969-696969696969",
  "transactionId": "84848484-8484-4484-8484-848484848484",
  "databaseCommitToken": "188f32cdc4dbea2bb563fe87962a397c58ef61a2bf40e5721aa3459fab4394ea",
  "outboxBatchId": "86868686-8686-4686-8686-868686868686",
  "originTransactionId": "81818181-8181-4181-8181-818181818181",
  "originDatabaseCommitToken": "02ef07dac371db4fea6d3ac6eb6aef3b85739ea31045640b6d6a8675fd9a4fbc",
  "originOutboxBatchId": "82828282-8282-4282-8282-828282828282",
  "deletionAuthorityId": "7a7a7a7a-7a7a-4a7a-8a7a-7a7a7a7a7a7a",
  "deletionAuthorityDigest": "160619c4181c7038f942229d29ccae3e5442d691eafcdee60be085fb5532e6bb",
  "outputCursorRevision": 4,
  "outputCursorDigest": "7f1e7af6e2d2046ed9a42af81895aa316666cb362a1599d1b2ba47dd496b9bd5",
  "commentInventoryObservationId": "79797979-7979-4979-8979-797979797979",
  "commentInventoryDigest": "b80a4d76019288a77527be048269d04e0e6cd8da249833372d9f89e15479cfab"
}
